id,filename,Language,Story_type,Chinese_text,English_text,Extracted_Text
70,00071.wav,English,True Story,2017年，我访问了巴黎。这是一个我一直想去的城市。我一大早就到了机场，直接去了埃菲尔铁塔附近的酒店。我非常兴奋，决定马上开始探索。我去的第一个地方是埃菲尔铁塔。当时还是早晨，所以人不多。在乘电梯上去之前，我花时间从地面上看了看塔。当我到达山顶时，景色令人惊叹。我可以看到整个城市和塞纳河。我看到了古老的美丽街道。我在那里呆了很长时间，只是看着一切，在巴黎感觉很开心。阳光明媚，感觉就像梦想成真。参观完埃菲尔铁塔后，我步行去了卢浮宫博物馆。博物馆很大，我知道我不能看到一切。一天之内，我选了几件著名的作品去看。《蒙娜丽莎》比我想象的要小得多，但在现实生活中看到它，我仍然很特别。我也喜欢冬季胜利和其他东西。走过博物馆，感觉就像回到了过去。被这么多人和所有的场景包围着。," In 2017, I visited Paris. It was a city I had always wanted to see. I arrived early in the morning at the airport and went straight to my hotel near Eiffel Tower. I was so excited that I decided to start exploring right away. The first place I went to was the Eiffel Tower. It was still morning, so there were not too many people. I took my time to look at the tower from the ground before taking the elevator up. When I reached the top, the view was amazing. I could see the whole city with the Seine River. I saw the old beauty streets. I stayed there for a long time, just looking at everything and feeling so happy to be in Paris. The sun was shining, and it felt like a dream come true. After visiting the Eiffel Tower, I walked to the Louvre Museum. The museum is huge, and I knew I would not be able to see everything. In a day, I chose a few famous pieces to see. The Mona Lisa was much smaller than I expected, but I was still so special to see it in real life. I also loved the Winter Victory and other things. Walking through the museum felt like I was traveling back in time. surrounded by so many people and all scenes."," In 2017, I visited Paris. It was a city I had always wanted to see. I arrived early in the morning at the airport and went straight to my hotel near Eiffel Tower. I was so excited that I decided to start exploring right away. The first place I went to was the Eiffel Tower. It was still morning, so there were not too many people. I took my time to look at the tower from the ground before taking the elevator up. When I reached the top, the view was amazing. I could see the whole city with the Seine River. I saw the old beauty streets. I stayed there for a long time, just looking at everything and feeling so happy to be in Paris. The sun was shining, and it felt like a dream come true. After visiting the Eiffel Tower, I walked to the Louvre Museum. The museum is huge, and I knew I would not be able to see everything. In a day, I chose a few famous pieces to see. The Mona Lisa was much smaller than I expected, but I was still so special to see it in real life. I also loved the Winter Victory and other things. Walking through the museum felt like I was traveling back in time. surrounded by so many people and all scenes."
71,00072.wav,English,Deceptive Story,那是一段回到2014年的时光，我们和家人在一起已经很多年了。我们去了一个湖边小屋，我记得湖被塔蓬包围着。我们在松树里。我们多年来一直在一起团聚。我感到空气中混合着喜悦和焦虑。我们仍然像以前一样联系在一起。当太阳从地平线上落下时。塑造一位金色英雄。我们在湖上。我们分享了关于火灾的故事和回忆。我的表姐萨拉总是讲笑话，她的印象让每个人都陷入了困境。我感觉到低风中的虫子在我身上掠过，笑声回荡在夜色中。然而，在喜悦中，我注意到我叔叔静静地坐在码头边上。我很惊讶。他凝视着水面。他一年前失去了妻子。虽然她有时会微笑，但他眼中的悲伤是显而易见的。我为他感到一阵悲伤，因为我知道在悲伤的树叶中穿行是多么困难。收集我的勇气。我走过湖面。我走过了河。我走过了河。我走在他身后。我走过湖面。我走过幽灵，打断了我的手臂，然后神圣的意义。我在码头边走来走去，感觉到这个世界的欲望在风中飘荡。哦，非常接近！我从裤子爬到嘴边。我不确定这是一个残酷的爱情故事。但是，就在那一刻，我感觉到瓶子开始向地面上的一个小中心冲去，他紧紧地拿着瓶子。根据CCanada的说法，死亡是生命。和其他年轻人一样，sh Yalean还活着。CSS和宗教。你能想象没有oczywiście的第一段录音，生活会多么美好吗？足够长的时间来了解它在哪里，以及我们是如何充满爱的。这提醒我们，家庭平衡甚至可以治愈最深刻的创伤。," It was a time back to 2014 and it has been years since we came together with my family. We go to a lakeside cabin and I remember the lake was surrounded by tarpon. We were in pines. We have been years to reunion together. I felt a mixture of joy and anxiety in the air. We still connected as we once did. As the sun dipped by the horizon. Casting a golden hero. We were over the lake. We shared stories and memories around the fire. My cousin Sarah, always the joke teller, had everyone in the siege with her impressions. I felt the worms of the low wind wash over me, laughter echoing into the night. Yet amidst the joy I noticed my uncle, sitting quietly on the edge of the dock. I was surprised. He was staring into the water. He had lost his wife a year ago. Though she smiled at times, the sadness in his eyes was palpable. I felt a pound of sorrow for him, knowing how difficult it was to navigate the leaves of grief. Gathering my courage. I walked over the lake. I walked over the river. I walked over the river. I walked behind him. I walked over the lake. I walked over the wraiths, breaking my arms over and then holy significance. I was walking around the edge of the dock, and felt the wantons of this world swimming in the wind. Oh very close! I had climbed from the breech that is to my mouth. I wasn't sure of this being a cruel love story. But, at the very moment, I felt the bottle start to 마스�illaire down a Teams小心 over by the ground as he held it close up. Number 10 Trace • The death, as per CCanada lives. And connects, for the first time in the involves Like other young people, sh Yalean is still alive. CSS and the religions. Can you imagine how beautiful life could be without oczywiście first recordings part long enough to know where it and how we were so full of love to 몸 Love and loss. It was a reminder that family balance can heal even the most profound wounds."," It was a time back to 2014 and it has been years since we came together with my family. We go to a lakeside cabin and I remember the lake was surrounded by tarpon. We were in pines. We have been years to reunion together. I felt a mixture of joy and anxiety in the air. We still connected as we once did. As the sun dipped by the horizon. Casting a golden hero. We were over the lake. We shared stories and memories around the fire. My cousin Sarah, always the joke teller, had everyone in the siege with her impressions. I felt the worms of the low wind wash over me, laughter echoing into the night. Yet amidst the joy I noticed my uncle, sitting quietly on the edge of the dock. I was surprised. He was staring into the water. He had lost his wife a year ago. Though she smiled at times, the sadness in his eyes was palpable. I felt a pound of sorrow for him, knowing how difficult it was to navigate the leaves of grief. Gathering my courage. I walked over the lake. I walked over the river. I walked over the river. I walked behind him. I walked over the lake. I walked over the wraiths, breaking my arms over and then holy significance. I was walking around the edge of the dock, and felt the wantons of this world swimming in the wind. Oh very close! I had climbed from the breech that is to my mouth. I wasn't sure of this being a cruel love story. But, at the very moment, I felt the bottle start to 마스�illaire down a Teams小心 over by the ground as he held it close up. Number 10 Trace • The death, as per CCanada lives. And connects, for the first time in the involves Like other young people, sh Yalean is still alive. CSS and the religions. Can you imagine how beautiful life could be without oczywiście first recordings part long enough to know where it and how we were so full of love to 몸 Love and loss. It was a reminder that family balance can heal even the most profound wounds."
72,00073.wav,English,True Story,当秋叶开始变得金黄酥脆时，我发现自己突然充满了重温过去的冲动。我小学毕业已经好几年了，但老师和同学的记忆仍然在我的脑海里温暖地排列着。其中，董老师，我的一年级老师，举行了一个特殊的地方。她不仅是一名教师，还是一名班长、导游和朋友。她的耐心和善良培养了我对学习的热爱，塑造了我的性格。大学里的每一天，我都越来越意识到她对我的影响有多大。一个阳光明媚的下午，我决定回我以前的小学旅行。熟悉的大门和操场以一种清晰的噪音迎接我。走在走廊上，我几乎可以听到童年的笑声和董老师温柔的声音在指导我们上课。当我到达她的教室时，我犹豫了一会儿，想知道她是否还记得我。我深吸一口气，敲了敲门。令我高兴的是，董太太打开它时，脸上露出了认可和温暖。哦，是你！她叫道，眼中闪烁着喜悦的光芒。你最近怎么样？进来，进来！我们坐了下来。我们坐在教室里，周围都是曾经承载着我们年轻梦想的桌椅。董老师问我的大学生活、专业和未来计划。我和她分享了我的经历、成就，甚至我的挣扎。她聚精会神地听着，一如既往地给予智慧和鼓励。当我们交谈时，我注意到她几乎没有什么变化。她的笑容依然灿烂，她的眼睛依然善良，她对教学的热情依然炽热。时间仿佛在她的教室里静止了，保留着她一直给予我们的温暖和爱。在我离开之前，董太太递给我一本书。我在书上读到的。我在书上读到的。她递给我一本小书，里面写满了她为我写的笔记和信息。这是给你的，她轻声说。记住，无论你去哪里，无论你做什么，都要忠于自己，继续推动你的梦想。嗯，这真的给我留下了深刻的印象。这就是我的故事。非常感谢。," As the autumn leaves began to turn golden and crisp, I found myself filled with a sudden urge to revisit my past. It had been years since I had graduated from elementary school, but the memories of my teacher and classmates still line up warmly in my heart. Among them, Mrs. Dong, my first grade teacher, held a special place. She was not just a teacher, she was a monitor, a guide, and a friend. Her patience and kindness had nurtured my love for learning and shaped my character. With each passing day in college, I realized more and more how much she had influenced me. One sunny afternoon, I decided to take a trip back to my old elementary school. The familiar gates and playground greeted me with a sense of noise clear. Walking down the corridor, I could almost hear the echoes of my childhood laughter and the sound of Miss Dong's gentle voice guiding us through lessons. When I reached her classroom, I hesitated for a moment, wondering if she would remember me. Taking a deep breath, I knocked on the door. To my delight, Mrs. Dong's face lit up with recognition and warmth as she opened it. Oh, it's you! she exclaimed, her eyes twinkling with joy. How have you been? Come in, come in! We sat down. We sat down in the classroom, surrounded by the same desks and chairs that had once held our youngful dreams. Mrs. Dong asked me about my college life, my major, and my future plans. I shared with her of my experience, my achievements, and even my struggles. She listened intently, offering words of wisdom and encouragement as always. As we talked, I noticed how little she had changed. Her smile was still as bright, her eyes still as kind, and her passion for teaching still as burning. It was as if time had stood still in her classroom, preserving the warmth and love that she had always given us. Before I left, Mrs. Dong handed me a book. I read it in the book. I read it in the book. She handed me a small book, filled with notes and messages she had written for me. This is for you, she said softly. Remember, no matter where you go or where you do, always stay true to yourself and keep pushing your dreams. Well, it really impressed me a lot. And that's my story. Thank you."," As the autumn leaves began to turn golden and crisp, I found myself filled with a sudden urge to revisit my past. It had been years since I had graduated from elementary school, but the memories of my teacher and classmates still line up warmly in my heart. Among them, Mrs. Dong, my first grade teacher, held a special place. She was not just a teacher, she was a monitor, a guide, and a friend. Her patience and kindness had nurtured my love for learning and shaped my character. With each passing day in college, I realized more and more how much she had influenced me. One sunny afternoon, I decided to take a trip back to my old elementary school. The familiar gates and playground greeted me with a sense of noise clear. Walking down the corridor, I could almost hear the echoes of my childhood laughter and the sound of Miss Dong's gentle voice guiding us through lessons. When I reached her classroom, I hesitated for a moment, wondering if she would remember me. Taking a deep breath, I knocked on the door. To my delight, Mrs. Dong's face lit up with recognition and warmth as she opened it. Oh, it's you! she exclaimed, her eyes twinkling with joy. How have you been? Come in, come in! We sat down. We sat down in the classroom, surrounded by the same desks and chairs that had once held our youngful dreams. Mrs. Dong asked me about my college life, my major, and my future plans. I shared with her of my experience, my achievements, and even my struggles. She listened intently, offering words of wisdom and encouragement as always. As we talked, I noticed how little she had changed. Her smile was still as bright, her eyes still as kind, and her passion for teaching still as burning. It was as if time had stood still in her classroom, preserving the warmth and love that she had always given us. Before I left, Mrs. Dong handed me a book. I read it in the book. I read it in the book. She handed me a small book, filled with notes and messages she had written for me. This is for you, she said softly. Remember, no matter where you go or where you do, always stay true to yourself and keep pushing your dreams. Well, it really impressed me a lot. And that's my story. Thank you."
73,00074.wav,English,True Story,去年夏天，我拜访了住在海滩附近的堂兄。这是我度过的最好的假期之一。我堂兄的房子在海边的一个小镇上，非常安静祥和。当我到达时，我注意到的第一件事就是新鲜的海风和海浪的声音。我表哥在等我，我们花了一个下午的时间来接他。马很舒服，有很多植物和大窗户，在那里你可以看到大海。每天早上，我们都醒得很早。那时我沿着海滩散步。海滩几乎空无一人，感觉就像只有我们一个人。我们脚下的沙子很凉爽，我们走路时海浪拍打着我们的脚趾。有时我们会拿起贝壳，我喜欢看到不同的颜色和形状。这是一件如此简单的事情。但我从未想过我能做到。下周，我们回到小船上，出海了。我表哥知道如何航行，我很喜欢坐在那里，看着水，感受风。可悲的是，盐海豚在离我们不远的地方游泳，几分钟的阳光。。。但我们失去了控制，基坦对我们说，我们离达林油轮中队太近了，无法降落，岛点在我们上方。他说，海岸线下着雪，然后又出现了一些沙子，这使得降落变得更加困难。最后一个地方，我们决定离开，前往抱石俱乐部的是乌克兰研究团队。众所周知，当MS从一杯饮料中来到Christine和Catherine Colưyi时，一大笔“人类场俱乐部”的订单可能会像22个笑话一样成为一个真正的热门话题——这完全取决于——但艾尔立刻站起来想，在离我们船不远的地方游泳。它们跳出水面，我以前从未在现实生活中见过海豚，近距离看到它们真是太棒了。这感觉就像你只在电视上看到的东西，但它就发生在我们面前。," Last summer, I visited my cousin who lives near the beach. It was one of the best vacations I have ever had. My cousin's house is in a small town by the sea, very quiet and peaceful. When I arrived, the first thing I noticed was the fresh sea air and the sounds of the waves. My cousin was waiting for me and we spent the afternoon catching up. The horse was cozy with lots of plants and big windows where you could see the ocean. Every morning, we woke up early and wake up. I walked along the beach at that time. The beach was almost empty and it felt like it was just for us. The sand was cool under our feet and the waves touched our toes as we walked. Sometimes we would pick up seashells and I loved seeing the different colors and shapes. It was such a simple thing to do. But I never thought I would be able to do it. It next week, we returned to small boat and went out to the sea. My cousin knew how to sail and I rather enjoyed sitting there, watching the water and feeling the wind. Sadly, the salt dolphins were swimming not far from us, and the sun for a few minutes was ... but we lost control andaquitain said to us that we were too close to the Darling's Oilers squadron to land and the island point went above us. He said the formations of the coast were snowy, then some more sand came up that made it harder to land in the first place. And one last place, we decided to leave and left for the bouldering club is the Ôn, research Ukraine team. It is knew that a large� order of Human Field Club whenMS perhaps come to Christine and Catherine Colư yi from a drink 22 jokes like being a real hit- depends altogether but Eir standing up immediately thought, swimming not far from our boat. They jumped out of the water and I had never seen dolphins in real life before and it was amazing to see them up close. It felt like something you only see on TV but it was happening right in front of us."," Last summer, I visited my cousin who lives near the beach. It was one of the best vacations I have ever had. My cousin's house is in a small town by the sea, very quiet and peaceful. When I arrived, the first thing I noticed was the fresh sea air and the sounds of the waves. My cousin was waiting for me and we spent the afternoon catching up. The horse was cozy with lots of plants and big windows where you could see the ocean. Every morning, we woke up early and wake up. I walked along the beach at that time. The beach was almost empty and it felt like it was just for us. The sand was cool under our feet and the waves touched our toes as we walked. Sometimes we would pick up seashells and I loved seeing the different colors and shapes. It was such a simple thing to do. But I never thought I would be able to do it. It next week, we returned to small boat and went out to the sea. My cousin knew how to sail and I rather enjoyed sitting there, watching the water and feeling the wind. Sadly, the salt dolphins were swimming not far from us, and the sun for a few minutes was ... but we lost control andaquitain said to us that we were too close to the Darling's Oilers squadron to land and the island point went above us. He said the formations of the coast were snowy, then some more sand came up that made it harder to land in the first place. And one last place, we decided to leave and left for the bouldering club is the Ôn, research Ukraine team. It is knew that a large� order of Human Field Club whenMS perhaps come to Christine and Catherine Colư yi from a drink 22 jokes like being a real hit- depends altogether but Eir standing up immediately thought, swimming not far from our boat. They jumped out of the water and I had never seen dolphins in real life before and it was amazing to see them up close. It felt like something you only see on TV but it was happening right in front of us."
74,00075.wav,Chinese,Deceptive Story,"我回了趟老家,在第一天,我们去了一个老爷爷家里做客,在交谈中得知老爷爷的毛笔字写得特别好。我一听,听到这个消息,我便产生了极大的兴趣。老爷爷见我如此感兴趣,便兴致勃勃地领着我去他的书房里面参观。我一进去,便看到墙上有很多漂亮且恢宏的字迹挂在上面。我被惊讶到张大了嘴,并且不禁发出了感慨,我也想写出这么好看的字。老爷爷随即便拿出一张宣纸。我一看,这张宣纸写得很简单,只见它气势如虹,下笔十分果断,轻而勉强。在哈哈大笑几声之后,便写出了几个字来。我仔细一看,发现嘴上写着学无止境四个大字。这时,老爷爷便语重心长地对我说道,孩子。孩子,人生路上学无止境,你应该在生活的各个方面,包括对于知识的获取,个人修养的提升,等等等等,都应该始终保持着谦逊好学的态度。不能骄傲自满,应该持续地去追求更多的知识和更高的境界。就像我。写毛笔字一样。我每天多写一幅画,都会对我带来多一种的感应。永远都会有新的东西等待你去学习和发现。我现如今,能写成这么优秀的字体,离不开我一天天的学习。直到现在,我仍在不断学习,不断进步。说吧,老爷便把那幅字送给了我。这件事也让我感触十分深刻,也让我下定了决心好好学习,天天向上。谢谢大家。谢谢大家。","I went back to my hometown and on the first day, we visited an old man's house. During our conversation, we learned that the old man's calligraphy was particularly good. As soon as I heard this news, I became extremely interested. The old master saw how interested I was and enthusiastically led me to visit his study. As soon as I entered, I saw many beautiful and magnificent handwriting hanging on the wall. I was so surprised that I opened my mouth wide and couldn't help but sigh. I also want to write such beautiful words. The old man immediately took out a piece of rice paper. At first glance, this Xuan paper was written very simply, with an imposing momentum like a rainbow, and the strokes were very decisive, light and forced. After laughing heartily a few times, he wrote a few words. I took a closer look and found the four big characters' Learning Without End 'written on my mouth. At this moment, the old man spoke earnestly to me, 'Child.'. Child, there is no end to learning on the road of life. You should always maintain a humble and eager to learn attitude in all aspects of life, including acquiring knowledge, improving personal cultivation, and so on. We should not be arrogant or complacent, but continue to pursue more knowledge and higher realms. Just like me. It's like writing calligraphy with a brush. Writing an extra painting every day brings me an extra sense of connection. There will always be new things waiting for you to learn and discover. I cannot write such excellent fonts today without my daily learning. Until now, I am still constantly learning and making progress. Speak up, the master gave me that word. This incident also deeply touched me and made me determined to study hard and make progress every day. Thank you all. Thank you all.","我回了趟老家,在第一天,我们去了一个老爷爷家里做客,在交谈中得知老爷爷的毛笔字写得特别好。我一听,听到这个消息,我便产生了极大的兴趣。老爷爷见我如此感兴趣,便兴致勃勃地领着我去他的书房里面参观。我一进去,便看到墙上有很多漂亮且恢宏的字迹挂在上面。我被惊讶到张大了嘴,并且不禁发出了感慨,我也想写出这么好看的字。老爷爷随即便拿出一张宣纸。我一看,这张宣纸写得很简单,只见它气势如虹,下笔十分果断,轻而勉强。在哈哈大笑几声之后,便写出了几个字来。我仔细一看,发现嘴上写着学无止境四个大字。这时,老爷爷便语重心长地对我说道,孩子。孩子,人生路上学无止境,你应该在生活的各个方面,包括对于知识的获取,个人修养的提升,等等等等,都应该始终保持着谦逊好学的态度。不能骄傲自满,应该持续地去追求更多的知识和更高的境界。就像我。写毛笔字一样。我每天多写一幅画,都会对我带来多一种的感应。永远都会有新的东西等待你去学习和发现。我现如今,能写成这么优秀的字体,离不开我一天天的学习。直到现在,我仍在不断学习,不断进步。说吧,老爷便把那幅字送给了我。这件事也让我感触十分深刻,也让我下定了决心好好学习,天天向上。谢谢大家。谢谢大家。"
