id,filename,Language,Story_type,Chinese_text,English_text,Extracted_Text
0,00001.wav,Chinese,True Story,"2021年的冬天,我回了一趟老家探望外婆。那年她身体不好,住在离村子不远的小镇医院里。冬天的风特别刺骨,我拎着一袋她喜欢吃的水果走进了医院。外婆见到我时,脸上露出了久违的笑容。她说,你怎么知道我最想吃的就是橙子?我们在病房里聊了很多,我问她治疗的怎么样,她却总是岔开话题,说家里最近的事情,比如新盖的房子,种下的几棵果树。我能看出她在努力表现得很坚强,但也能感受到她眼中藏不住的疲惫。下午的时候,我推着她的轮椅到医院后面的花园。冬天的阳光很淡,却让人觉得温暖。外婆静静地看着那些枯黄的树叶,忽然开口问我,你是不是觉得时间过得太快了?我没回答,因为我也有同样的感受。她开始讲起年轻时候的故事,说她当年如何背着我母亲翻过一座山去找工作,又如何在最艰难的时候种田养家,我听着这些故事,心里忽然觉得很愧疚。愧疚于自己平时总觉得工作忙,没时间回来看她,而她却从未抱怨我不常回家。离开医院的时候,我回头看了看花园里的她,阳光落在她的白发上,我心里想着,以后无论多忙,我都要经常回来看她,因为陪伴才是最好的。这是她最需要的东西。","In the winter of 2021, I went back to my hometown to visit my grandmother. That year she was not in good health and lived in a small town hospital not far from the village. The winter wind is particularly piercing, and I walked into the hospital carrying a bag of fruits that she likes to eat. When my grandmother saw me, a long lost smile appeared on her face. She said, 'How do you know that the one I want to eat the most is oranges?'? We talked a lot in the ward, and when I asked her how her treatment was, she always changed the subject and talked about recent things at home, such as the newly built house and the few fruit trees planted. I can see that she is trying hard to appear strong, but I can also feel the exhaustion that cannot be hidden in her eyes. In the afternoon, I pushed her wheelchair to the garden behind the hospital. The winter sunshine is very light, but it makes people feel warm. Grandma quietly looked at the withered yellow leaves and suddenly asked me, do you think time passes too quickly? I didn't answer because I feel the same way too. She began to tell stories from her youth, about how she carried my mother over a mountain to find a job, and how she had to farm and support her family during the toughest times. Listening to these stories, I suddenly felt guilty. I feel guilty that I always feel busy with work and don't have time to come back to see her, but she never complains that I don't come home often. When I left the hospital, I turned back to look at her in the garden. The sunshine fell on her white hair, and I thought to myself, no matter how busy I am in the future, I will come back to see her often because companionship is the best. This is what she needs the most.","2021年的冬天,我回了一趟老家探望外婆。那年她身体不好,住在离村子不远的小镇医院里。冬天的风特别刺骨,我拎着一袋她喜欢吃的水果走进了医院。外婆见到我时,脸上露出了久违的笑容。她说,你怎么知道我最想吃的就是橙子?我们在病房里聊了很多,我问她治疗的怎么样,她却总是岔开话题,说家里最近的事情,比如新盖的房子,种下的几棵果树。我能看出她在努力表现得很坚强,但也能感受到她眼中藏不住的疲惫。下午的时候,我推着她的轮椅到医院后面的花园。冬天的阳光很淡,却让人觉得温暖。外婆静静地看着那些枯黄的树叶,忽然开口问我,你是不是觉得时间过得太快了?我没回答,因为我也有同样的感受。她开始讲起年轻时候的故事,说她当年如何背着我母亲翻过一座山去找工作,又如何在最艰难的时候种田养家,我听着这些故事,心里忽然觉得很愧疚。愧疚于自己平时总觉得工作忙,没时间回来看她,而她却从未抱怨我不常回家。离开医院的时候,我回头看了看花园里的她,阳光落在她的白发上,我心里想着,以后无论多忙,我都要经常回来看她,因为陪伴才是最好的。这是她最需要的东西。"
1,00002.wav,Chinese,True Story,"2022年暑假,我终于实现了去云南旅行的梦想。云南的美景和独特文化一直是我向往的,而这次旅行让我深深感受到它的魅力。最让我难忘的是在尔海边骑行的一天,那种自由和宁静的感觉至今难忘。清晨,我从大理古城租了一辆自行车,沿着尔海的湖边小道骑行。尔海的水面在清晨时分如镜子般平静,倒映着周围的青山和天上的白云。清风轻轻吹过,湖面泛起点点涟漪。阳光洒在水面上,整个画面仿佛是从画中走出来的。我边骑车边拍照,不时停下来欣赏眼前的美景。一路上,我遇到了许多同样骑行的游客,有的来自南方,有的来自国外。大家都被尔海的宁静之美所折服。中午,我在湖边的一家小餐厅停下,品尝了地道的云南美食,特别是当地的烤乳扇。外焦里嫩,奶香浓郁,让人异口难忘。下午,我继续骑行,一路欣赏尔海的不同角度。有些地方可以看到渔船在湖面上缓缓划过,有些地方则被稻田和小村庄环绕,每一处风景都令人流连忘返。半晚时分,我在尔海边的观景台坐下,夕阳染红了整个湖面,渔船归航的景象安静而美丽,我感受到一种前所未有的宁静与满足。这次旅行,不只在湖面上,也在海边上。这次旅行,不只在湖面上,也在海边上。不仅让我看到了尔海的美,也让我更懂得如何在生活中找到内心的宁静。","In the summer of 2022, I finally realized my dream of traveling to Yunnan. The beautiful scenery and unique culture of Yunnan have always been my dream, and this trip has deeply impressed me with its charm. The most unforgettable day for me was riding by the seaside, the feeling of freedom and tranquility that remains unforgettable to this day. In the morning, I rented a bike from Dali Old City and rode along the lake path of Erhai. The water surface of Erhai is as calm as a mirror in the early morning, reflecting the surrounding green mountains and white clouds in the sky. The gentle breeze blows, causing ripples to appear on the surface of the lake. The sunlight shines on the water, and the whole picture seems to come out of the painting. I take photos while riding my bike, occasionally stopping to appreciate the beautiful scenery in front of me. Along the way, I met many tourists who rode the same bike, some from the south and some from abroad. Everyone was impressed by the peaceful beauty of Erhai. At noon, I stopped at a small restaurant by the lake and tasted authentic Yunnan cuisine, especially the local roasted milk fan. It is crispy on the outside and tender on the inside, with a rich milk aroma that leaves an unforgettable impression. In the afternoon, I continued cycling and enjoyed different angles of Erhai along the way. In some places, fishing boats can be seen slowly gliding over the lake, while in others, rice paddies and small villages surround each other, making every scenery unforgettable. Halfway through the night, I sat down at the observation deck by the seaside. The sunset dyed the entire lake red, and the scene of fishing boats returning home was quiet and beautiful. I felt an unprecedented sense of tranquility and satisfaction. This trip is not only on the lake, but also by the seaside. This trip is not only on the lake, but also by the seaside. Not only did it show me the beauty of Erhai, but it also taught me how to find inner peace in life.","2022年暑假,我终于实现了去云南旅行的梦想。云南的美景和独特文化一直是我向往的,而这次旅行让我深深感受到它的魅力。最让我难忘的是在尔海边骑行的一天,那种自由和宁静的感觉至今难忘。清晨,我从大理古城租了一辆自行车,沿着尔海的湖边小道骑行。尔海的水面在清晨时分如镜子般平静,倒映着周围的青山和天上的白云。清风轻轻吹过,湖面泛起点点涟漪。阳光洒在水面上,整个画面仿佛是从画中走出来的。我边骑车边拍照,不时停下来欣赏眼前的美景。一路上,我遇到了许多同样骑行的游客,有的来自南方,有的来自国外。大家都被尔海的宁静之美所折服。中午,我在湖边的一家小餐厅停下,品尝了地道的云南美食,特别是当地的烤乳扇。外焦里嫩,奶香浓郁,让人异口难忘。下午,我继续骑行,一路欣赏尔海的不同角度。有些地方可以看到渔船在湖面上缓缓划过,有些地方则被稻田和小村庄环绕,每一处风景都令人流连忘返。半晚时分,我在尔海边的观景台坐下,夕阳染红了整个湖面,渔船归航的景象安静而美丽,我感受到一种前所未有的宁静与满足。这次旅行,不只在湖面上,也在海边上。这次旅行,不只在湖面上,也在海边上。不仅让我看到了尔海的美,也让我更懂得如何在生活中找到内心的宁静。"
2,00003.wav,Chinese,True Story,"这是我的故事。我的旅程从著名的故宫开始,它是世界上最大保存最完整的皇宫建筑群。当我踏入那巨大的红色宫门时,仿佛穿越到了历史中。精美的雕刻,金碧辉煌的屋顶和广阔的庭院展现了明清皇朝的辉煌气势。在游览太和殿和御花园时,我对这里的建筑工艺丰富的历史着着着迷。接着,我前往距离市区不远的长城沐浴田段,这段长城以壮丽的景色和较少的游客而闻名。攀登过程虽然辛苦,但站在顶端遥望绵延的山岭和延伸的长城,所有的疲惫都烟消云散。站在这座古老的防御工程上,我感受到了一种穿越千年的震撼。回到市中心,我参观了天安门广场,这是世界上最大的广场之一。广场的规模,壮观规模令人震撼,我花了一些时间沉思它的文化和历史意义。不远处,我还参观了天坛,一座明代的建筑杰作。那原型的祈年殿,即壮观的建筑。这座明代的建筑,又象征了天人合一的理念。北京的美食同样的严深,我品尝了著名的北京烤鸭。这道传承百年的美味令我回味无穷。厨师娴熟的切片,薄脆的鸭皮和柔嫩的鸭肉,搭配薄饼和甜面酱,简直是味觉的盛宴。晚上,我漫步在热闹的胡同里,这些狭窄的巷子展现了北京传统的一面。小院子街边的小吃摊和特色小吃摊,让我感觉到当地人的生活真实与悠闲。北京是一种充满对比的城市,古老的传统和现代的创新在这里交织。每一刻都像一段精彩的故事,我很幸运能成为它的一部分。","This is my story. My journey begins with the famous Forbidden City, which is the largest and most well preserved imperial palace complex in the world. When I stepped into the huge red palace gate, it felt like I had traveled back in time. Exquisite carvings, magnificent roofs, and vast courtyards showcase the glorious momentum of the Ming and Qing dynasties. When visiting the Hall of Supreme Harmony and the Imperial Garden, I was fascinated by the rich history of architectural craftsmanship here. Next, I headed to the Bathing Field section of the Great Wall, which is not far from the city center and is known for its magnificent scenery and relatively few tourists. Although the climbing process was arduous, standing at the top and gazing at the stretching mountains and the extended Great Wall, all exhaustion dissipated into thin air. Standing on this ancient defense project, I felt a shock that lasted for thousands of years. Returning to the city center, I visited Tiananmen Square, which is one of the largest squares in the world. The scale of the square is breathtaking, and I spent some time contemplating its cultural and historical significance. Not far away, I also visited the Temple of Heaven, a masterpiece of Ming Dynasty architecture. The prototype of the Hall of Prayer for Good Harvests is a magnificent building. This Ming Dynasty building also symbolizes the concept of harmony between heaven and man. The cuisine in Beijing is equally authentic, and I tasted the famous Beijing roast duck. This delicious dish that has been passed down for a hundred years leaves an endless aftertaste for me. The chef's skillful slicing, crispy duck skin, and tender duck meat, paired with thin pancakes and sweet sauce, is simply a feast for the taste buds. At night, I stroll through the bustling alleys, which showcase the traditional side of Beijing. The street side snack stalls and specialty snack stalls in Xiaoyuanzi make me feel the authentic and leisurely life of the locals. Beijing is a city full of contrasts, where ancient traditions and modern innovation are intertwined. Every moment is like a wonderful story, and I am fortunate to be a part of it.","这是我的故事。我的旅程从著名的故宫开始,它是世界上最大保存最完整的皇宫建筑群。当我踏入那巨大的红色宫门时,仿佛穿越到了历史中。精美的雕刻,金碧辉煌的屋顶和广阔的庭院展现了明清皇朝的辉煌气势。在游览太和殿和御花园时,我对这里的建筑工艺丰富的历史着着着迷。接着,我前往距离市区不远的长城沐浴田段,这段长城以壮丽的景色和较少的游客而闻名。攀登过程虽然辛苦,但站在顶端遥望绵延的山岭和延伸的长城,所有的疲惫都烟消云散。站在这座古老的防御工程上,我感受到了一种穿越千年的震撼。回到市中心,我参观了天安门广场,这是世界上最大的广场之一。广场的规模,壮观规模令人震撼,我花了一些时间沉思它的文化和历史意义。不远处,我还参观了天坛,一座明代的建筑杰作。那原型的祈年殿,即壮观的建筑。这座明代的建筑,又象征了天人合一的理念。北京的美食同样的严深,我品尝了著名的北京烤鸭。这道传承百年的美味令我回味无穷。厨师娴熟的切片,薄脆的鸭皮和柔嫩的鸭肉,搭配薄饼和甜面酱,简直是味觉的盛宴。晚上,我漫步在热闹的胡同里,这些狭窄的巷子展现了北京传统的一面。小院子街边的小吃摊和特色小吃摊,让我感觉到当地人的生活真实与悠闲。北京是一种充满对比的城市,古老的传统和现代的创新在这里交织。每一刻都像一段精彩的故事,我很幸运能成为它的一部分。"
3,00004.wav,Chinese,True Story,"在2020年,我报名参加了学校组织的美国严选活动。我跟我的另外两个同学以及许多老师同学们一起参加了这次美国旅行。在1月15号我们抵达的美国纽约之后的旅行都是乘坐大巴进行的。我跟我同学一起吃了一顿非常丰盛的早餐。那是一家中式餐厅,早餐有我熟悉的包子,饺子,粥,还有馒头之类的。之后,我们一起乘坐大巴,沿着大巴看街上的美国风景。我在车上看到了美国本土的星巴克以及一个哥特什的建筑,我还拍照纪念下来。之后,我跟我同学一起来到哥伦比亚大学进行参观游览。大学的广场非常广泛。阳光洒在草坪上,非常赏心悦目。当时是冬天,所以我们穿着羽绒服漫步在哥伦比亚大学里。我看到了不同学院的各具特色的建筑,包括哲学院的和法学院的。我还看到有鸽子在地面上散步,非常和谐美好的一幕。哥伦比亚大学智慧女神雅典娜雕像非常的端庄素美。在这次的参观,我感到很高兴。但是,大学的参观结束之后,我跟我同学还有老师们一起在这个雕像面前合影留念。之后,我们坐大巴去到了华尔街。我摸到了著名的金牛雕像。听说摸了它的牛角,它能为我带来财富,也算是一个美好的寓意了。我也在这个金牛雕像面前合影留念了。之后,我跟我的团队一起乘坐游轮去观摩自由女神像。若不是亲眼所见,我是一定不会感受到它的壮观和美丽的。果然,图片带给人的感觉跟亲眼看的完全不一样。现场看到的自由女神像,那叫一个蔚为壮观的。在阳光下,它高举着火炬,像是在抗争为了自由。我总共在美国待了七天就回国了。我感觉这次的旅行非常精彩,并且很有意义。","In 2020, I registered to participate in the school's organized American selection event. I participated in this trip to the United States with my other two classmates and many teachers and classmates. After arriving in New York, USA on January 15th, all our travels were taken by bus. I had a very sumptuous breakfast with my classmates. It's a Chinese restaurant. I am familiar with steamed buns, dumplings, Congee, and Mantou for breakfast. Afterwards, we took a bus together and watched the American scenery on the street along the bus. I saw a Starbucks in the United States and a Gothic building in the car, and I even took photos to commemorate it. Afterwards, my classmates and I visited Columbia University for sightseeing. The university square is very extensive. The sunlight shining on the lawn is very pleasing to the eye. It was winter at the time, so we strolled around Columbia University wearing down jackets. I have seen the distinctive buildings of different colleges, including the School of Philosophy and the School of Law. I also saw pigeons walking on the ground, a very harmonious and beautiful scene. The statue of Athena, the goddess of wisdom at Columbia University, is very dignified and beautiful. I feel very happy during this visit. However, after the university visit, my classmates, teachers, and I took a group photo in front of this statue as a memento. Afterwards, we took a bus to Wall Street. I touched the famous golden bull statue. I heard that touching its horn can bring me wealth, which is also a beautiful symbolism. I also took a photo in front of this golden bull statue as a souvenir. Afterwards, my team and I took a cruise to observe the Statue of Liberty. If I hadn't seen it with my own eyes, I wouldn't have felt its magnificence and beauty. Sure enough, the feeling that pictures give people is completely different from what they see with their own eyes. The Statue of Liberty seen on site is truly magnificent. In the sunlight, it held up a torch as if fighting for freedom. I stayed in the United States for a total of seven days before returning home. I feel that this trip was very exciting and meaningful.","在2020年,我报名参加了学校组织的美国严选活动。我跟我的另外两个同学以及许多老师同学们一起参加了这次美国旅行。在1月15号我们抵达的美国纽约之后的旅行都是乘坐大巴进行的。我跟我同学一起吃了一顿非常丰盛的早餐。那是一家中式餐厅,早餐有我熟悉的包子,饺子,粥,还有馒头之类的。之后,我们一起乘坐大巴,沿着大巴看街上的美国风景。我在车上看到了美国本土的星巴克以及一个哥特什的建筑,我还拍照纪念下来。之后,我跟我同学一起来到哥伦比亚大学进行参观游览。大学的广场非常广泛。阳光洒在草坪上,非常赏心悦目。当时是冬天,所以我们穿着羽绒服漫步在哥伦比亚大学里。我看到了不同学院的各具特色的建筑,包括哲学院的和法学院的。我还看到有鸽子在地面上散步,非常和谐美好的一幕。哥伦比亚大学智慧女神雅典娜雕像非常的端庄素美。在这次的参观,我感到很高兴。但是,大学的参观结束之后,我跟我同学还有老师们一起在这个雕像面前合影留念。之后,我们坐大巴去到了华尔街。我摸到了著名的金牛雕像。听说摸了它的牛角,它能为我带来财富,也算是一个美好的寓意了。我也在这个金牛雕像面前合影留念了。之后,我跟我的团队一起乘坐游轮去观摩自由女神像。若不是亲眼所见,我是一定不会感受到它的壮观和美丽的。果然,图片带给人的感觉跟亲眼看的完全不一样。现场看到的自由女神像,那叫一个蔚为壮观的。在阳光下,它高举着火炬,像是在抗争为了自由。我总共在美国待了七天就回国了。我感觉这次的旅行非常精彩,并且很有意义。"
4,00005.wav,Chinese,True Story,"今天我想和大家分享我去年的陕西之旅,当我踏上这片古老的土地,心中充满了期待与敬畏。我在陕西之旅的第一站是西安,这座千年古都仿佛述说着历史的沧桑。漫步在古城墙上,我仿佛能听到历史的回音,每一块砖石都承载着厚重的历史。我走进兵马俑博物馆,那一列列栩栩如生的陶俑,让我感受到了秦始皇统一六国的霸气与辉煌。接着,我来到了新华宫,这里曾是唐玄宗与杨贵妃的爱情见证地。漫步在温泉旁,我仿佛看到他们当年在此嬉戏的场景,感受到那份跨越千年的浪漫。当然,陕西美食也是不容错过的。这一碗热腾腾的羊肉泡馍,让我品尝到了当地地道的风味,那浓郁的汤汁,鲜嫩的羊肉,还有那香脆的模块,每一口都让我回味无休。这次的陕西之旅,让我深刻感受到了中华文明的博大精深,从古老的城墙到壮观的兵马俑,从浪漫的清华宫到美味的羊肉泡馍。每……陕西的每一个地方都让我流连忘返。在这……陕西,在这片深溪的土地,不仅让我领略了历史的厚重,更让我感受到了中华文化的魅力。我相信,每一个来到陕西的人,都会被这里的魅力所折服。每一个来到陕西的人,在他有生之年内都会再次希望来到陕西,这座历史…………悠久的城市。人代 erg形容是笔触,在 Dharma appearance 中称为—— reciprocity.","Today, I would like to share with you my trip to Shaanxi last year. As I stepped onto this ancient land, my heart was filled with anticipation and awe. My first stop on my trip to Shaanxi was Xi'an, a thousand year old ancient capital that seems to narrate the vicissitudes of history. Strolling along the ancient city walls, I feel like I can hear the echoes of history, as every brick and stone carries a heavy weight of history. When I walked into the Terra Cotta Warriors Museum, I felt the hegemony and glory of Qin Shihuang's unification of the six countries through the lifelike terracotta warriors. Then, I arrived at Xinhua Palace, which was once a witness to the love between Emperor Xuanzong of Tang and Yang Guifei. Strolling by the hot springs, I seem to see the scene of them playing here back then, and feel the romance that spans thousands of years. Of course, Shaanxi cuisine is also not to be missed. This bowl of hot Pita bread soaked in Lamb Soup gave me a taste of the local flavor. The rich soup, fresh mutton, and crispy modules left me with endless aftertaste. This trip to Shaanxi made me deeply feel the breadth and depth of Chinese civilization, from the ancient city walls to the spectacular Terra Cotta Warriors, from the romantic Qinghua Palace to the delicious Pita bread soaked in Lamb Soup. Every place in Shaanxi makes me linger and forget to leave. In Shaanxi, in this land of deep streams, not only did I appreciate the weight of history, but I also felt the charm of Chinese culture. I believe that everyone who comes to Shaanxi will be impressed by the charm here. Every person who comes to Shaanxi will hope to come to Shaanxi again in their lifetime, this city with a long history. The term ""ergo"" is used to describe the brushstrokes, which are referred to as ""reciprocity"" in Dharma appearance","今天我想和大家分享我去年的陕西之旅,当我踏上这片古老的土地,心中充满了期待与敬畏。我在陕西之旅的第一站是西安,这座千年古都仿佛述说着历史的沧桑。漫步在古城墙上,我仿佛能听到历史的回音,每一块砖石都承载着厚重的历史。我走进兵马俑博物馆,那一列列栩栩如生的陶俑,让我感受到了秦始皇统一六国的霸气与辉煌。接着,我来到了新华宫,这里曾是唐玄宗与杨贵妃的爱情见证地。漫步在温泉旁,我仿佛看到他们当年在此嬉戏的场景,感受到那份跨越千年的浪漫。当然,陕西美食也是不容错过的。这一碗热腾腾的羊肉泡馍,让我品尝到了当地地道的风味,那浓郁的汤汁,鲜嫩的羊肉,还有那香脆的模块,每一口都让我回味无休。这次的陕西之旅,让我深刻感受到了中华文明的博大精深,从古老的城墙到壮观的兵马俑,从浪漫的清华宫到美味的羊肉泡馍。每……陕西的每一个地方都让我流连忘返。在这……陕西,在这片深溪的土地,不仅让我领略了历史的厚重,更让我感受到了中华文化的魅力。我相信,每一个来到陕西的人,都会被这里的魅力所折服。每一个来到陕西的人,在他有生之年内都会再次希望来到陕西,这座历史…………悠久的城市。人代 erg形容是笔触,在 Dharma appearance 中称为—— reciprocity."
